conversation_id_str,created_at,favorite_count,full_text,id_str,image_url,in_reply_to_screen_name,lang,location,quote_count,reply_count,retweet_count,tweet_url,user_id_str,username,clean_text,label
2006411593915998687,2025-12-31T17:06:15.000Z,0,"naoo close dulu ya! DAN HAPPY NEW YEAR GUYSS!!🎉✨

semogaa di tahun ini kita sehat selaluu dan setiap urusannya selalu dilancarkan yaaa. hope u all have a wonderful day😽💗",2006411593915998687,,,in,,0,0,0,https://x.com/stetlle/status/2006411593915998687,1013001581225103360,stetlle,naoo close dulu ya dan happy new year guyss semogaa di tahun ini kita sehat selaluu dan setiap urusannya selalu dilancarkan yaaa hope u all have a wonderful day,positif
2044133723969552675,2026-04-14T19:20:32.000Z,288,she's one cup tall https://t.co/vZ7GMxLOqg,2044133723969552675,https://pbs.twimg.com/media/HF44ygbaUAAUk8C.jpg,,en,,0,4,9,https://x.com/ziblunt/status/2044133723969552675,1922194751551655936,ziblunt,shes one cup tall,positif
2043705186372473165,2026-04-13T14:57:41.000Z,2618,"// [ Genshin Spoilers ]

Yo wdym they just leaked / teased the model of the Tsaritsa

via mamamo https://t.co/VDjMQdXFHt",2043705186372473165,https://pbs.twimg.com/media/HFyyFE2aMAAr6l8.png,,en,,45,38,102,https://x.com/NotMochiiViz/status/2043705186372473165,1147781296833196037,NotMochiiViz,genshin spoilers yo wdym they just leaked teased the model of the tsaritsa via mamamo,negatif
2043755787756155142,2026-04-13T18:18:45.000Z,35,"Lohen wip
#genshinimpact #Lohen #genshin https://t.co/Npr10YTcWp",2043755787756155142,https://pbs.twimg.com/media/HFzhDwNasAQZLuk.jpg,,de,,0,0,3,https://x.com/Reosue_/status/2043755787756155142,1593587575465574401,Reosue_,lohen wip,positif
2044040488949539105,2026-04-14T13:10:03.000Z,405,but i heard he was barely 1 year old??????????? https://t.co/Rwm9J6ctXo,2044040488949539105,https://pbs.twimg.com/media/HF3j_gQasAUQOGs.jpg,,en,,4,13,8,https://x.com/TheIllugaFreak/status/2044040488949539105,1975720842232537090,TheIllugaFreak,but i heard he was barely year old,negatif
2043638534897336711,2026-04-13T10:32:50.000Z,309,"🤍Cosplay コスプレ
原神 | Genshin Impact
- 八重神子 -

📸 @tok_tak_tok_tak 

狐しっぽ付き

#GenshinImpact  #yaemiko #コステン https://t.co/7hg2Oz613Y",2043638534897336711,https://pbs.twimg.com/media/HFx2aoJaMAAlSwu.jpg,,ja,,2,1,23,https://x.com/nanashi__zz__/status/2043638534897336711,1895953786453266432,nanashi__zz__,cosplay genshin impact,negatif
2043611908314746901,2026-04-13T08:47:02.000Z,5,Pls star rail oomfs I need this https://t.co/XnZpAlYyNg,2043611908314746901,,,en,,0,0,0,https://x.com/MeishoDotto/status/2043611908314746901,1958907961507487744,MeishoDotto,pls star rail oomfs i need this,positif
2043902837839527988,2026-04-14T04:03:05.000Z,121,best standard character in the game 🙌,2043902837839527988,,,en,,0,1,5,https://x.com/SipSipStefen/status/2043902837839527988,756265224,SipSipStefen,best standard character in the game,positif
2043631803647570090,2026-04-13T10:06:05.000Z,2173,"WiFiなおったーーーーー！！！

リクエストの星＆ホタル😍 https://t.co/CAgkjo4A0N",2043631803647570090,https://pbs.twimg.com/media/HFxwIeeaIAAQzro.jpg,,ja,,0,6,253,https://x.com/mfmftorisan/status/2043631803647570090,1874043605087870976,mfmftorisan,wifi,positif
2006325692469002583,2025-12-31T11:24:55.000Z,0,"HALOOOO! SELAMAT MALAM(⁠*⁠´⁠ω⁠｀⁠*⁠) yang butuh bantuan joki genshin seperti rakun, battle, farming, event, story dll bisa langsung dm rami yaaa! https://t.co/dz4b4C7ura",2006325692469002583,,,in,,0,0,0,https://x.com/ramiqoonly/status/2006325692469002583,1791084030831779840,ramiqoonly,haloooo selamat malam yang butuh bantuan joki genshin seperti rakun battle farming event story dll bisa langsung dm rami yaaa,positif
2044122219014414816,2026-04-14T18:34:49.000Z,959,POV: you get flashbacks of your last walk with your chud son before you die ❤️ https://t.co/bwPkkKTHZC,2044122219014414816,https://pbs.twimg.com/amplify_video_thumb/2044122153394622465/img/klzQLBQ419qU6r_R.jpg,,en,,0,2,80,https://x.com/DailyGenshinWQ/status/2044122219014414816,1971644131702362112,DailyGenshinWQ,pov you get flashbacks of your last walk with your chud son before you die,negatif
2043806463596920904,2026-04-13T21:40:07.000Z,968,wow! genshin really needs to add skip button https://t.co/tfV1hDz2GA,2043806463596920904,https://pbs.twimg.com/media/HF0PIXtXQAAV4fU.jpg,,en,,7,15,24,https://x.com/Rumtopf16/status/2043806463596920904,1616863560252153857,Rumtopf16,wow genshin really needs to add skip button,positif
2006484374703964179,2025-12-31T21:55:28.000Z,1,"siapa sangka menghabiskan malam tahun baru di genshin bersama @mitszuya 

pic terakhir lagi berdoa untuk banner columbina https://t.co/5iR9P8LRdQ",2006484374703964179,https://pbs.twimg.com/media/G9h25iNaAAA9SeX.jpg,,in,,0,1,0,https://x.com/cornradine/status/2006484374703964179,1861619116437831680,cornradine,siapa sangka menghabiskan malam tahun baru di genshin bersama pic terakhir lagi berdoa untuk banner columbina,positif
2043708069054758963,2026-04-13T15:09:08.000Z,135,what if i ship them too. what if thighhighbootsshipping https://t.co/9xpwwic1Bg,2043708069054758963,https://pbs.twimg.com/media/HFy1lTBbcAAAQVP.jpg,,en,,4,5,14,https://x.com/ahbedua/status/2043708069054758963,1915768010482331648,ahbedua,what if i ship them too what if thighhighbootsshipping,negatif
2044044896772993383,2026-04-14T13:27:34.000Z,92,Do we think 3.7 is going to be the patch of Charon’s garment?? He’s the oldest 6* without one so far. The fact that 3 characters released after him have garments before him is kind of crazy,2044044896772993383,,,en,,4,2,3,https://x.com/Maitleith/status/2044044896772993383,1369219591906291719,Maitleith,do we think is going to be the patch of charons garment hes the oldest without one so far the fact that characters released after him have garments before him is kind of crazy,negatif
2043644075362951597,2026-04-13T10:54:51.000Z,1466,"6.6v2 NICOLE CHANGES:

C2: Grace of Kenosisincreases ATK by an additional 240-&gt;300 [...] Guidance of Theosis decreases nearby opponents' Elemental RES against the corresponding character's Elemental Type by 20 -&gt; 25

C4: Each character can gain this effect once every 17s -&gt; 16s https://t.co/8STq77sUPB",2043644075362951597,https://pbs.twimg.com/media/HFx7dHlXkAAEtPI.jpg,,en,,52,56,53,https://x.com/AboutNodKrai/status/2043644075362951597,1791215727208202240,AboutNodKrai,v nicole changes c grace of kenosisincreases atk by an additional gt guidance of theosis decreases nearby opponents elemental res against the corresponding characters elemental type by gt c each character can gain this effect once every s gt s,negatif
2043643110706581857,2026-04-13T10:51:01.000Z,1948,"✦ New Artifact Set | Heaven's Gift

#GenshinLunaVI #原神 #GenshinImpact #Genshin #Linnea #Nicole #Prune #Lohen https://t.co/Wk119hWkaV",2043643110706581857,https://pbs.twimg.com/media/HFx6bDJXsAA0ZFl.jpg,,en,,41,19,70,https://x.com/Midei0214/status/2043643110706581857,1490510151664771073,Midei0214,new artifact set heavens gift,positif
2006262107877302738,2025-12-31T07:12:15.000Z,0,Udah bebas dari update lads gantian genshin. EMANG NAK ANJ 😭😩😩😭😭,2006262107877302738,,,in,,0,0,0,https://x.com/nonespecial12/status/2006262107877302738,1397433142374387713,nonespecial12,udah bebas dari update lads gantian genshin emang nak anj,negatif
2006336704152785213,2025-12-31T12:08:40.000Z,0,1.3 pas banner Keqing wangy wangy 😭🤣 welkin pas ada banyak inceran doang (tiap region banyak inceran) https://t.co/MkIAZsuebe,2006336704152785213,https://pbs.twimg.com/media/G9fwmbhaYAA2ffC.jpg,,in,,0,0,0,https://x.com/tehceluv/status/2006336704152785213,975347995171422208,tehceluv,pas banner keqing wangy wangy welkin pas ada banyak inceran doang tiap region banyak inceran,negatif
2043662955880071574,2026-04-13T12:09:52.000Z,5,does anyone love linnea can u do her story quest for me,2043662955880071574,,,en,,0,1,1,https://x.com/y6emiku/status/2043662955880071574,1287404745489960963,y6emiku,does anyone love linnea can u do her story quest for me,positif
2043723177122058644,2026-04-13T16:09:10.000Z,2068,"[6.6 LEAKS]

Very suspiciously low line count, Pantalone being there for unknown reasons, Dottore disappearing after a fight cutscene again..

Could this be another fake death? https://t.co/3IWufj0zcW",2043723177122058644,https://pbs.twimg.com/media/HFzDZi5WwAEmGWm.jpg,,en,,39,50,122,https://x.com/D0TT0R3/status/2043723177122058644,1930654283365482496,D0TT0R3,leaks very suspiciously low line count pantalone being there for unknown reasons dottore disappearing after a fight cutscene again could this be another fake death,negatif
2044024626498666926,2026-04-14T12:07:01.000Z,53,"varflins shippers: varflins real?

hoyoverse: dont even joke, lad... *makes an anemo-wielding character with flins' color palette who's originally from nod krai but is currently staying in mondstadt* https://t.co/i1Qg7p82yW",2044024626498666926,https://pbs.twimg.com/media/HF3VjxIaIAACkxR.jpg,,en,,1,0,7,https://x.com/chudomrovich/status/2044024626498666926,1417409198288117761,chudomrovich,varflins shippers varflins real hoyoverse dont even joke lad makes an anemowielding character with flins color palette whos originally from nod krai but is currently staying in mondstadt,negatif
2006245563080270136,2025-12-31T06:06:31.000Z,0,Genshin bener-bener obat tidur terbaik (baru bangun dari tidur 2 jam gara-gara ngantuk main genshin).,2006245563080270136,,,in,,0,0,0,https://x.com/Neczha/status/2006245563080270136,1805092358683512832,Neczha,genshin benerbener obat tidur terbaik baru bangun dari tidur jam garagara ngantuk main genshin,positif
2043628184600490283,2026-04-13T09:51:42.000Z,486,I’m still here btw. https://t.co/ULFTQq2rAT,2043628184600490283,https://pbs.twimg.com/amplify_video_thumb/2043628030006816768/img/XLNjPk-_5TCMdbrs.jpg,,en,,7,12,85,https://x.com/D0TT0R3/status/2043628184600490283,1930654283365482496,D0TT0R3,im still here btw,positif
2043779335740666020,2026-04-13T19:52:19.000Z,291,give us some natlan expansion here with some sumeru x natlan event during that patch PLEASE https://t.co/KbtQZ7Zt11,2043779335740666020,https://pbs.twimg.com/media/HFz2YIuasAAdcUY.jpg,,en,,0,2,19,https://x.com/skirkreeyn/status/2043779335740666020,1637514017613946880,skirkreeyn,give us some natlan expansion here with some sumeru x natlan event during that patch please,positif
2006310503136817153,2025-12-31T10:24:34.000Z,0,"Awali jumat di 2026 mu, dgn live sp genshin",2006310503136817153,,,in,,0,0,0,https://x.com/dramathurgy/status/2006310503136817153,3798174614,dramathurgy,awali jumat di mu dgn live sp genshin,positif
2043879092198514868,2026-04-14T02:28:43.000Z,41,"Even at a loss, HY will continue to operate the pedo game HONKAI 2 because it is Daiwei's favorite game. HONKAI 2 will not be released globally because of concerns that a boycott of pedo by players would lead to a decline in global revenue. #GenshinImpact #HSR #HI3 https://t.co/qD6UFpYZ4F",2043879092198514868,https://pbs.twimg.com/media/HF1RKkfXMAAHaKp.jpg,,en,,0,2,6,https://x.com/deweibs/status/2043879092198514868,1203347418814672898,deweibs,even at a loss hy will continue to operate the pedo game honkai because it is daiweis favorite game honkai will not be released globally because of concerns that a boycott of pedo by players would lead to a decline in global revenue,negatif
2043672933520781477,2026-04-13T12:49:31.000Z,144,i love that it’s a pink instead of the usual red/orange https://t.co/mVR0hfEOMf,2043672933520781477,https://pbs.twimg.com/media/HFyVs0bakAAxSTF.jpg,,en,,1,1,6,https://x.com/timelymond/status/2043672933520781477,1963734344112988161,timelymond,i love that its a pink instead of the usual redorange,positif
2043676297210319125,2026-04-13T13:02:53.000Z,873,"Raiden Shogun | 雷電将軍 ⚡
#GenshinImpact #原神 https://t.co/ENxhNsJyy1",2043676297210319125,https://pbs.twimg.com/media/HFyYwfTaUAAQdNY.jpg,,ja,,0,3,58,https://x.com/SLOTH303/status/2043676297210319125,1452287269017112582,SLOTH303,raiden shogun,negatif
2006331133005643913,2025-12-31T11:46:32.000Z,0,Wiwa udah fast response yaa ฅ⁠^⁠•⁠ﻌ⁠•⁠^⁠ฅ https://t.co/u8z9jnPML5,2006331133005643913,https://pbs.twimg.com/media/G9friGPbMAEIuW8.jpg,,in,,0,0,0,https://x.com/ilom/status/2006331133005643913,473237436,ilom,wiwa udah fast response yaa,positif
2006396648986165298,2025-12-31T16:06:52.000Z,0,Hadeeh keasikan main genshin sampai ketinggalan live Bangtan,2006396648986165298,,,in,,0,0,0,https://x.com/daesuga_/status/2006396648986165298,1022100524898742274,daesuga_,hadeeh keasikan main genshin sampai ketinggalan live bangtan,negatif
2043967817922555988,2026-04-14T08:21:17.000Z,46,"""You can't hear a gif""
The gif in question:
#Genshinimpact #Rerir",2043967817922555988,,,en,,0,1,8,https://x.com/Rerir_daily/status/2043967817922555988,1930109149477523456,Rerir_daily,you cant hear a gif the gif in question,negatif
2044145046862049737,2026-04-14T20:05:32.000Z,5,"“So you really are an angel?
Then yay, that works! I'm a mage, and you're an angel, so we match perfectly.
Want to join my Hexenzirkel?
It's going to be the funnest, awesomest, best club in all of Teyvat — I promise!“ 
little Alice must’ve been so cute with her oversized hat😭",2044145046862049737,,,en,,0,1,0,https://x.com/hertadolll/status/2044145046862049737,1678411609700483074,hertadolll,so you really are an angel then yay that works im a mage and youre an angel so we match perfectly want to join my hexenzirkel its going to be the funnest awesomest best club in all of teyvat i promise little alice mustve been so cute with her oversized hat,positif
2043633804708053055,2026-04-13T10:14:02.000Z,397,"cos / ナヴィア

 #GenshinImpact    #Navia https://t.co/2JpdmC8f5x",2043633804708053055,https://pbs.twimg.com/media/HFxyHJpbYAAY7Cj.jpg,,ja,,0,1,41,https://x.com/r2oxAzZvvr86010/status/2043633804708053055,1974169565912580096,r2oxAzZvvr86010,cos,positif
2043701636812738967,2026-04-13T14:43:35.000Z,6714,"[Contains 6.6 Leaks / Spoilers]

ACT X:

THE THREE SHADES SHARE A SMALL CONVERSATION WITH NAHIDA ‼️

(Through their communication devices)
#GenshinImpact #Nahida https://t.co/q3JqVaEi06",2043701636812738967,https://pbs.twimg.com/media/HFyvzX3aEAAqunE.jpg,,en,,125,31,429,https://x.com/AboutTeyvat/status/2043701636812738967,1379818006650425346,AboutTeyvat,contains leaks spoilers act x the three shades share a small conversation with nahida through their communication devices,positif
2043686999891091903,2026-04-13T13:45:25.000Z,132,"Назовите вашего любимого персонажа Genshin Impact и какие у вас с ним есть сходства.
У меня с моим сходятся:
- отчислили с биофака
- навыки работы с механизмами
- оба кудрявые
- оба родились в пустыне
- обоих за мировоззрение близкие считают тварью
- быстрая смена интересов https://t.co/9NgP1u8zwv",2043686999891091903,https://pbs.twimg.com/media/HFyifhnWkAA7Ubo.jpg,,ru,,5,2,3,https://x.com/Oxillumen/status/2043686999891091903,2025634098858119168,Oxillumen,genshin impact,negatif
2043952114561380352,2026-04-14T07:18:53.000Z,172,Jp lohens drip marketing is already at 100k likes wow 😭,2043952114561380352,,,en,,0,3,10,https://x.com/Timely_Lohen/status/2043952114561380352,1966586210219954176,Timely_Lohen,jp lohens drip marketing is already at k likes wow,positif
2043732974211149842,2026-04-13T16:48:06.000Z,3417,Why is her drip so stunning? I can't wait anymore me and your husband are dying for your banner drop 😭 I love you Nicole I've been licking screen all day and now it's your husband's turn 🫵 #varcole https://t.co/78kYXleye3,2043732974211149842,https://pbs.twimg.com/media/HFzMSxgasAAlVI4.jpg,,en,,6,2,439,https://x.com/lilyrosaleen/status/2043732974211149842,1633761239607431168,lilyrosaleen,why is her drip so stunning i cant wait anymore me and your husband are dying for your banner drop i love you nicole ive been licking screen all day and now its your husbands turn,negatif
2006196491363250501,2025-12-31T02:51:31.000Z,4,"helloo! aku ada redi stok leyot genshin hsr harga tertera di alt yaa, bisa qris dapat ava jpg+png jugaa, mari jajan! 🥺💟🫶

#zonauang #zonaba https://t.co/g1rayXy9Ua",2006196491363250501,https://pbs.twimg.com/media/G9dxCj_bQAAyWK4.jpg,,in,,4,0,14,https://x.com/byeeong/status/2006196491363250501,1298124501561954304,byeeong,helloo aku ada redi stok leyot genshin hsr harga tertera di alt yaa bisa qris dapat ava jpgpng jugaa mari jajan,positif
2044151475530805386,2026-04-14T20:31:04.000Z,2461,unc still got it https://t.co/zYqhcWmDxb,2044151475530805386,https://pbs.twimg.com/media/HF5I6zxagAASxG_.jpg,,en,,11,2,352,https://x.com/akhronly/status/2044151475530805386,1922670502243680256,akhronly,unc still got it,negatif
2043662282383585715,2026-04-13T12:07:12.000Z,340,it always fmu whenever genshin makes a character in lore extremely strong meanwhile they’re competing w xinyan in dmg numbers department https://t.co/m9jkfaVo4J,2043662282383585715,https://pbs.twimg.com/amplify_video_thumb/2027735759415848960/img/7U4tdSibzboQmd-o.jpg,,en,,1,10,20,https://x.com/citsacrob/status/2043662282383585715,1215016247332610049,citsacrob,it always fmu whenever genshin makes a character in lore extremely strong meanwhile theyre competing w xinyan in dmg numbers department,positif
2006118478969733474,2025-12-30T21:41:31.000Z,11,"✧〳Lil Zenith Cheeb (˶ˆᗜˆ˵)/ 

[ #dottore #genshin #dottoresegment ] https://t.co/k3etkTa3Be",2006118478969733474,https://pbs.twimg.com/media/G9cpnWCXwAEmvzE.jpg,,in,,0,1,4,https://x.com/kcho_cola/status/2006118478969733474,1904566069160710145,kcho_cola,lil zenith cheeb,positif
2043884606609412344,2026-04-14T02:50:38.000Z,1678,"Made with a contribution of Wolfy Thy Pirate Wolf's Sereniteapot as base.
#Columbina #Genshinimpact #原神 https://t.co/9HNxlBn1su",2043884606609412344,https://pbs.twimg.com/media/HF1Vt0KX0AAaiUC.jpg,,en,,0,3,206,https://x.com/Zaharadis/status/2043884606609412344,1951270358343933952,Zaharadis,made with a contribution of wolfy thy pirate wolfs sereniteapot as base,positif
2043630271556395081,2026-04-13T10:00:00.000Z,484,"Clorinde・クロリンデ
#GenshinImpact #原神 https://t.co/3MIQbLV3PE",2043630271556395081,https://pbs.twimg.com/media/HFuz6bYakAAdtQb.jpg,,ja,,0,0,19,https://x.com/ShiroMeliaX/status/2043630271556395081,2020118422965874691,ShiroMeliaX,clorinde,positif
2043802383373791289,2026-04-13T21:23:54.000Z,1239,Acho que cancel jump é cancel mais feio do jogo,2043802383373791289,,,pt,,3,26,31,https://x.com/BloomCharts/status/2043802383373791289,1916354897638719488,BloomCharts,acho que cancel jump cancel mais feio do jogo,negatif
2043630967953191122,2026-04-13T10:02:46.000Z,714,"Beta 6.6v2 1.31gb, via seele",2043630967953191122,,,et,,11,23,15,https://x.com/AboutNodKrai/status/2043630967953191122,1791215727208202240,AboutNodKrai,beta v gb via seele,positif
2044075707488186816,2026-04-14T15:30:00.000Z,702,Genshin Week Day 2; hopefully Gaming gets just as much love as Cyno did yesterday! https://t.co/HZJYvAg4tT,2044075707488186816,https://pbs.twimg.com/media/HF3ghdjWUAAq1H4.jpg,,en,,0,3,51,https://x.com/AtelierRenders/status/2044075707488186816,1391583339874820099,AtelierRenders,genshin week day hopefully gaming gets just as much love as cyno did yesterday,positif
2043667034324787557,2026-04-13T12:26:05.000Z,577,"A bouquet of books? 
I want... ಥ⁠‿⁠ಥ

#dottolisa #dottore #lisaminci https://t.co/U4jgru2Wc0",2043667034324787557,https://pbs.twimg.com/media/HFyPnWTbkAATSD6.jpg,,en,,1,3,72,https://x.com/ArtKaolinite91/status/2043667034324787557,1070115421104222209,ArtKaolinite91,a bouquet of books i want,positif
2043729801198895242,2026-04-13T16:35:29.000Z,1776,THEYRE SAYING NAHIDA IS DYING IN 6.6… https://t.co/HtxXChnbff,2043729801198895242,https://pbs.twimg.com/amplify_video_thumb/1993977719080800256/img/RWcXsTlql-q5zoMz.jpg,,en,,44,31,156,https://x.com/skirkheels/status/2043729801198895242,1749186584937668608,skirkheels,theyre saying nahida is dying in,negatif
2044152899102470473,2026-04-14T20:36:44.000Z,71,"So what if the tree burned and it got to a point where it's irreversible, bad ending, game over, Nahida tells everyone to go spend time with their families while they still remember them, Kaveh goes home worried that he has no time to write to his mother, and he's",2044152899102470473,,,en,,0,1,6,https://x.com/Roui_roui/status/2044152899102470473,1661103004328534017,Roui_roui,so what if the tree burned and it got to a point where its irreversible bad ending game over nahida tells everyone to go spend time with their families while they still remember them kaveh goes home worried that he has no time to write to his mother and hes,negatif
2044177277173330146,2026-04-14T22:13:36.000Z,13,i don't know what's happening in the haikaveh fandom but is it because some players don't wanna see them together? did i get it right?,2044177277173330146,,,en,,0,4,0,https://x.com/cyntific/status/2044177277173330146,590226125,cyntific,i dont know whats happening in the haikaveh fandom but is it because some players dont wanna see them together did i get it right,negatif
2043605734970052798,2026-04-13T08:22:30.000Z,470,"me: cant wait for sumeru aq lol

me, inside: id sacrifice any character to have a full scene of collei and cyno talking about what happened in the manga and showing their parallelism, addressing the monster trapped inside her and how they found a new beginning in the forest PLEAS",2043605734970052798,,,en,,2,9,90,https://x.com/cyntific/status/2043605734970052798,590226125,cyntific,me cant wait for sumeru aq lol me inside id sacrifice any character to have a full scene of collei and cyno talking about what happened in the manga and showing their parallelism addressing the monster trapped inside her and how they found a new beginning in the forest pleas,negatif
2043814309000532017,2026-04-13T22:11:18.000Z,1935,"Practice. Don’t know what I was trying to do here..

#JingYuan #景元 #HonkaiStarRail https://t.co/8R18WXi2wx",2043814309000532017,https://pbs.twimg.com/media/HF0WRp2XQAAOS7f.jpg,,en,,1,0,338,https://x.com/TheFoxRealm/status/2043814309000532017,1393616541564932096,TheFoxRealm,practice dont know what i was trying to do here,negatif
2044200050020991357,2026-04-14T23:44:05.000Z,16,hello oomfs https://t.co/1meX6VQ6JV,2044200050020991357,https://pbs.twimg.com/tweet_video_thumb/HF51GiCX0AIgsNL.jpg,,tl,,0,9,0,https://x.com/kzscrly/status/2044200050020991357,1542662741785280512,kzscrly,hello oomfs,positif
2044020450896838774,2026-04-14T11:50:26.000Z,625,Genshin Impact. This doesn't even include my other platforms. https://t.co/vx4YU4p0cp,2044020450896838774,https://pbs.twimg.com/media/HF3RxMqXMAApoA0.jpg,,en,,4,10,6,https://x.com/LionmightMusic/status/2044020450896838774,18719599,LionmightMusic,genshin impact this doesnt even include my other platforms,negatif
2043685023287541986,2026-04-13T13:37:34.000Z,189,recent wips i have been sent https://t.co/OjonzxqrAO,2043685023287541986,https://pbs.twimg.com/media/HFygsewaAAAPRRa.jpg,,en,,0,1,3,https://x.com/curseshackled/status/2043685023287541986,1832011980695097344,curseshackled,recent wips i have been sent,negatif
2043874826763264224,2026-04-14T02:11:46.000Z,676,"Composer and Arranger: ?
Mondstadt BGM

#Genshin - #原神
Requested by _unit00pilot

︀︀Plays around the Temple of Space's overworld. https://t.co/U5fkw7i6Yz",2043874826763264224,https://pbs.twimg.com/amplify_video_thumb/2043874741992468480/img/y5nY08RCpdnYUhf_.jpg,,en,,12,10,128,https://x.com/genshin_music/status/2043874826763264224,1405931063910834178,genshin_music,composer and arranger mondstadt bgm requested by unitpilot plays around the temple of spaces overworld,positif
2044053519024464362,2026-04-14T14:01:50.000Z,519,"Columbina コロンビーナ 
#GenshinImpact #原神 https://t.co/abPXuWmj7X",2044053519024464362,https://pbs.twimg.com/media/HF3v10AW4AAa9I3.jpg,,ja,,0,6,25,https://x.com/KiraraOwlbear18/status/2044053519024464362,1954128647557902336,KiraraOwlbear18,columbina,positif
2043645371901940155,2026-04-13T11:00:00.000Z,551,"「  月の煌めき🌙𓈒𓏸︎︎︎ 」
          - The moon's sparkle -

コロンビーナモチーフの壺
第２弾を作ってみました🩵🪽

 #原神 #塵歌壺 #sereniteapot
 #コロンビーナ #Columbina https://t.co/Z9658aymI5",2043645371901940155,https://pbs.twimg.com/media/HFwAK7MbMAAw0hR.jpg,,ja,,0,13,68,https://x.com/mmmmei000/status/2043645371901940155,1531830692052881409,mmmmei000,the moons sparkle,negatif
2043997331113054364,2026-04-14T10:18:34.000Z,19448,"All characters from the preview got their drip marketing, except one...

#GenshinImpact https://t.co/RW3nPIaihg",2043997331113054364,https://pbs.twimg.com/media/HF28W0tXUAEzqUB.jpg,,en,,173,83,899,https://x.com/AboutNodKrai/status/2043997331113054364,1791215727208202240,AboutNodKrai,all characters from the preview got their drip marketing except one,negatif
2043914253833502748,2026-04-14T04:48:26.000Z,1353,"truly a walking weapon of war.. i thought it was a bit of a dead giveaway, considering the fact that a lot of parts in his design either take the form of a sword, a spearhead, a bow, a shield or a dagger https://t.co/O7UNtihx96",2043914253833502748,https://pbs.twimg.com/media/HF1xLqla4AA34Am.jpg,,en,,8,3,218,https://x.com/idrilas/status/2043914253833502748,1991908305443475456,idrilas,truly a walking weapon of war i thought it was a bit of a dead giveaway considering the fact that a lot of parts in his design either take the form of a sword a spearhead a bow a shield or a dagger,negatif
